{
  "$schema": "https://json-schema.org/draft/2020-12/schema",
  "$id": "https://github.com/Sunrisepeak/mcpp-safe/specs/schema/mc1-config.schema.json",
  "title": "MC1 0.4.0: [package.metadata.mcxx], read as JSON",
  "type": "object",
  "$defs": {
    "level": {
      "enum": [
        "allow",
        "warn",
        "deny",
        "off",
        "warning",
        "error"
      ]
    },
    "feature-id": {
      "type": "string",
      "pattern": "^(lib:|ext:)?[a-z0-9]+([-.][a-z0-9]+)*$"
    },
    "levels": {
      "type": "object",
      "propertyNames": {
        "$ref": "#/$defs/feature-id"
      },
      "additionalProperties": {
        "$ref": "#/$defs/level"
      }
    }
  },
  "properties": {
    "profile": {
      "oneOf": [
        {
          "type": "string",
          "minLength": 1
        },
        {
          "type": "array",
          "items": {
            "type": "string",
            "minLength": 1
          },
          "uniqueItems": true
        }
      ]
    },
    "features": {
      "$ref": "#/$defs/levels"
    },
    "modules": {
      "type": "object",
      "propertyNames": {
        "pattern": "^[A-Za-z_][A-Za-z0-9_]*(\\.[A-Za-z_][A-Za-z0-9_]*)*(:[A-Za-z_][A-Za-z0-9_]*(\\.[A-Za-z_][A-Za-z0-9_]*)*)?$"
      },
      "additionalProperties": {
        "$ref": "#/$defs/levels"
      }
    },
    "namespaces": {
      "type": "object",
      "propertyNames": {
        "pattern": "^[A-Za-z_][A-Za-z0-9_]*(::[A-Za-z_][A-Za-z0-9_]*)*$"
      },
      "additionalProperties": {
        "$ref": "#/$defs/levels"
      }
    },
    "plugins": {
      "$comment": "MC4 §3",
      "type": "object",
      "additionalProperties": {
        "type": "object",
        "additionalProperties": false,
        "properties": {
          "path": {
            "type": "string"
          },
          "version": {
            "type": "string"
          },
          "command": {
            "type": "array",
            "items": {
              "type": "string"
            },
            "minItems": 1
          },
          "timeout-ms": {
            "type": "integer",
            "minimum": 1
          },
          "library": {
            "type": "string",
            "$comment": "MC4 §3: a plugin library, loaded into the compiler (MC4 0.3.0)"
          }
        },
        "oneOf": [
          {
            "required": [
              "path"
            ],
            "not": {
              "anyOf": [
                {
                  "required": [
                    "version"
                  ]
                },
                {
                  "required": [
                    "library"
                  ]
                },
                {
                  "required": [
                    "command"
                  ]
                }
              ]
            }
          },
          {
            "required": [
              "version"
            ],
            "not": {
              "anyOf": [
                {
                  "required": [
                    "path"
                  ]
                },
                {
                  "required": [
                    "library"
                  ]
                },
                {
                  "required": [
                    "command"
                  ]
                }
              ]
            }
          },
          {
            "required": [
              "library"
            ],
            "not": {
              "anyOf": [
                {
                  "required": [
                    "path"
                  ]
                },
                {
                  "required": [
                    "version"
                  ]
                },
                {
                  "required": [
                    "command"
                  ]
                }
              ]
            }
          },
          {
            "required": [
              "command"
            ],
            "not": {
              "anyOf": [
                {
                  "required": [
                    "path"
                  ]
                },
                {
                  "required": [
                    "version"
                  ]
                },
                {
                  "required": [
                    "library"
                  ]
                }
              ]
            }
          }
        ]
      }
    },
    "imports": {
      "type": "object",
      "propertyNames": {
        "pattern": "^[A-Za-z_][A-Za-z0-9_.]*(:[A-Za-z_][A-Za-z0-9_.]*)?$"
      },
      "additionalProperties": {
        "type": "object",
        "required": [
          "allow"
        ],
        "additionalProperties": false,
        "properties": {
          "allow": {
            "type": "array",
            "items": {
              "$ref": "#/$defs/feature-id"
            },
            "minItems": 1
          },
          "reason": {
            "type": "string"
          }
        }
      },
      "description": "MC1 0.3.0: what an import of a module may bring in across the dialect boundary, waived over every import of it in the package (§7)."
    },
    "files": {
      "type": "object",
      "propertyNames": {
        "pattern": "^[^/]+(/[^/]+)*$",
        "description": "A glob relative to the manifest's directory, '/'-separated."
      },
      "additionalProperties": {
        "$ref": "#/$defs/levels"
      },
      "description": "The levels of the package's files a glob pattern matches, relative to the manifest's directory: `*` within a path component, `**` any number of components, `?` one character (MC1 0.4.0)."
    }
  }
}
